{
  "schema_version": 1,
  "vault_id": "11111111-2222-4333-8444-555555555555",
  "gerado_em": "2026-05-08T12:00:00-03:00",
  "items": [
    {
      "id": "a1111111-0001-4000-8000-000000000001",
      "tipo": "foto",
      "titulo": "Praia ao amanhecer",
      "data": "2026-04-22",
      "local": "Itacaré, BA",
      "duracao_seg": null,
      "tags": ["viagem", "casal", "praia"],
      "evento_vinculado": "e0000001-0000-4000-8000-000000000001",
      "diario_vinculado": null,
      "preview_path": ".ouroboros/preview/foto-001.jpg",
      "media_path": "memorias/2026-04-22/praia-amanhecer.heic",
      "para_abrir": false
    },
    {
      "id": "a1111111-0002-4000-8000-000000000002",
      "tipo": "foto",
      "titulo": "Café da manhã na varanda",
      "data": "2026-04-23",
      "local": "Itacaré, BA",
      "duracao_seg": null,
      "tags": ["viagem", "rotina"],
      "evento_vinculado": "e0000001-0000-4000-8000-000000000001",
      "diario_vinculado": null,
      "preview_path": ".ouroboros/preview/foto-002.jpg",
      "media_path": "memorias/2026-04-23/cafe-varanda.heic",
      "para_abrir": false
    },
    {
      "id": "a1111111-0003-4000-8000-000000000003",
      "tipo": "foto",
      "titulo": "Trilha ate o mirante",
      "data": "2026-04-24",
      "local": null,
      "duracao_seg": null,
      "tags": ["trilha", "viagem"],
      "evento_vinculado": null,
      "diario_vinculado": null,
      "preview_path": ".ouroboros/preview/foto-003.jpg",
      "media_path": "memorias/2026-04-24/trilha.heic",
      "para_abrir": true
    },
    {
      "id": "a1111111-0004-4000-8000-000000000004",
      "tipo": "foto",
      "titulo": "Almoço com a família",
      "data": "2026-04-30",
      "local": "Salvador, BA",
      "duracao_seg": null,
      "tags": ["familia", "almoco"],
      "evento_vinculado": null,
      "diario_vinculado": null,
      "preview_path": ".ouroboros/preview/foto-004.jpg",
      "media_path": "memorias/2026-04-30/almoco-familia.heic",
      "para_abrir": true
    },
    {
      "id": "a1111111-0005-4000-8000-000000000005",
      "tipo": "foto",
      "titulo": "Pôr do sol no Pelourinho",
      "data": "2026-05-01",
      "local": "Salvador, BA",
      "duracao_seg": null,
      "tags": ["viagem", "fotografia"],
      "evento_vinculado": null,
      "diario_vinculado": "d0000001-0000-4000-8000-000000000001",
      "preview_path": ".ouroboros/preview/foto-005.jpg",
      "media_path": "memorias/2026-05-01/por-do-sol.heic",
      "para_abrir": false
    },
    {
      "id": "b2222222-0001-4000-8000-000000000001",
      "tipo": "audio",
      "titulo": "Memo de viagem - reflexões",
      "data": "2026-04-22",
      "local": "Itacaré, BA",
      "duracao_seg": 142,
      "tags": ["audio", "viagem", "reflexao"],
      "evento_vinculado": "e0000001-0000-4000-8000-000000000001",
      "diario_vinculado": null,
      "preview_path": ".ouroboros/preview/audio-001.png",
      "media_path": "memorias/2026-04-22/memo-viagem.m4a",
      "para_abrir": false
    },
    {
      "id": "b2222222-0002-4000-8000-000000000002",
      "tipo": "audio",
      "titulo": "Pássaros no quintal",
      "data": "2026-05-03",
      "local": null,
      "duracao_seg": 38,
      "tags": ["natureza", "casa"],
      "evento_vinculado": null,
      "diario_vinculado": null,
      "preview_path": ".ouroboros/preview/audio-002.png",
      "media_path": "memorias/2026-05-03/passaros-quintal.m4a",
      "para_abrir": true
    },
    {
      "id": "c3333333-0001-4000-8000-000000000001",
      "tipo": "texto",
      "titulo": "Carta para o Eu de 2027",
      "data": "2026-05-04",
      "local": null,
      "duracao_seg": null,
      "tags": ["futuro", "carta"],
      "evento_vinculado": null,
      "diario_vinculado": "d0000001-0000-4000-8000-000000000002",
      "preview_path": ".ouroboros/preview/texto-001.txt",
      "media_path": "memorias/2026-05-04/carta-eu-2027.md",
      "para_abrir": false
    },
    {
      "id": "c3333333-0002-4000-8000-000000000002",
      "tipo": "texto",
      "titulo": "Lista de gratidões da semana",
      "data": "2026-05-05",
      "local": null,
      "duracao_seg": null,
      "tags": ["gratidao", "semana"],
      "evento_vinculado": null,
      "diario_vinculado": "d0000001-0000-4000-8000-000000000003",
      "preview_path": ".ouroboros/preview/texto-002.txt",
      "media_path": "memorias/2026-05-05/gratidao-semana.md",
      "para_abrir": false
    },
    {
      "id": "c3333333-0003-4000-8000-000000000003",
      "tipo": "texto",
      "titulo": "Insight sobre o ano",
      "data": "2026-05-06",
      "local": null,
      "duracao_seg": null,
      "tags": ["insight", "balanco"],
      "evento_vinculado": null,
      "diario_vinculado": null,
      "preview_path": ".ouroboros/preview/texto-003.txt",
      "media_path": "memorias/2026-05-06/insight-ano.md",
      "para_abrir": true
    },
    {
      "id": "d4444444-0001-4000-8000-000000000001",
      "tipo": "video",
      "titulo": "Ondas em Itacaré",
      "data": "2026-04-22",
      "local": "Itacaré, BA",
      "duracao_seg": 27,
      "tags": ["viagem", "praia", "ondas"],
      "evento_vinculado": "e0000001-0000-4000-8000-000000000001",
      "diario_vinculado": null,
      "preview_path": ".ouroboros/preview/video-001.jpg",
      "media_path": "memorias/2026-04-22/ondas-itacare.mp4",
      "para_abrir": false
    },
    {
      "id": "d4444444-0002-4000-8000-000000000002",
      "tipo": "video",
      "titulo": "Cachorro brincando",
      "data": "2026-05-02",
      "local": null,
      "duracao_seg": 15,
      "tags": ["pet", "cotidiano"],
      "evento_vinculado": null,
      "diario_vinculado": null,
      "preview_path": ".ouroboros/preview/video-002.jpg",
      "media_path": "memorias/2026-05-02/cachorro.mp4",
      "para_abrir": true
    }
  ]
}
